{
  "artifact_id": "da3e3381-6428-49db-b011-7df778edc535",
  "schema_version": "1.0.0",
  "source": {
    "image_hash": "8685e3f67bb3ff4c0bbbee31ffcc4c2fc2c0c6a54b1752d804ebc5859530d54e",
    "capture_timestamp": "2026-03-30T02:18:03.081366+00:00",
    "resolution": {
      "width": 3024,
      "height": 4032
    }
  },
  "landmarks": {
    "face_mesh": [
      {
        "index": 0,
        "x": 0.37741,
        "y": 0.342273,
        "z": 0.002312,
        "visibility": 1.0
      },
      {
        "index": 1,
        "x": 0.3946,
        "y": 0.33296,
        "z": -0.036488,
        "visibility": 1.0
      },
      {
        "index": 2,
        "x": 0.385759,
        "y": 0.331929,
        "z": -0.00971,
        "visibility": 1.0
      },
      {
        "index": 3,
        "x": 0.395467,
        "y": 0.306821,
        "z": -0.045082,
        "visibility": 1.0
      },
      {
        "index": 4,
        "x": 0.398447,
        "y": 0.328235,
        "z": -0.043109,
        "visibility": 1.0
      },
      {
        "index": 5,
        "x": 0.401624,
        "y": 0.318147,
        "z": -0.046094,
        "visibility": 1.0
      },
      {
        "index": 6,
        "x": 0.408674,
        "y": 0.287832,
        "z": -0.044917,
        "visibility": 1.0
      },
      {
        "index": 7,
        "x": 0.332784,
        "y": 0.260756,
        "z": -0.038286,
        "visibility": 1.0
      },
      {
        "index": 8,
        "x": 0.415207,
        "y": 0.270414,
        "z": -0.053556,
        "visibility": 1.0
      },
      {
        "index": 9,
        "x": 0.419675,
        "y": 0.26267,
        "z": -0.063341,
        "visibility": 1.0
      },
      {
        "index": 10,
        "x": 0.436123,
        "y": 0.219325,
        "z": -0.083257,
        "visibility": 1.0
      },
      {
        "index": 11,
        "x": 0.376315,
        "y": 0.34382,
        "z": 0.005358,
        "visibility": 1.0
      },
      {
        "index": 12,
        "x": 0.374887,
        "y": 0.345061,
        "z": 0.009316,
        "visibility": 1.0
      },
      {
        "index": 13,
        "x": 0.373129,
        "y": 0.346139,
        "z": 0.015196,
        "visibility": 1.0
      },
      {
        "index": 14,
        "x": 0.373685,
        "y": 0.347096,
        "z": 0.021204,
        "visibility": 1.0
      },
      {
        "index": 15,
        "x": 0.372779,
        "y": 0.3498,
        "z": 0.023287,
        "visibility": 1.0
      },
      {
        "index": 16,
        "x": 0.371277,
        "y": 0.352712,
        "z": 0.024084,
        "visibility": 1.0
      },
      {
        "index": 17,
        "x": 0.368804,
        "y": 0.355189,
        "z": 0.027971,
        "visibility": 1.0
      },
      {
        "index": 18,
        "x": 0.364788,
        "y": 0.355899,
        "z": 0.039137,
        "visibility": 1.0
      },
      {
        "index": 19,
        "x": 0.391483,
        "y": 0.334021,
        "z": -0.030303,
        "visibility": 1.0
      },
      {
        "index": 20,
        "x": 0.379375,
        "y": 0.32865,
        "z": -0.021132,
        "visibility": 1.0
      },
      {
        "index": 21,
        "x": 0.295081,
        "y": 0.204291,
        "z": -0.038188,
        "visibility": 1.0
      },
      {
        "index": 22,
        "x": 0.362295,
        "y": 0.272472,
        "z": -0.034923,
        "visibility": 1.0
      },
      {
        "index": 23,
        "x": 0.351491,
        "y": 0.271416,
        "z": -0.036727,
        "visibility": 1.0
      },
      {
        "index": 24,
        "x": 0.340566,
        "y": 0.268676,
        "z": -0.037453,
        "visibility": 1.0
      },
      {
        "index": 25,
        "x": 0.326774,
        "y": 0.260146,
        "z": -0.036332,
        "visibility": 1.0
      },
      {
        "index": 26,
        "x": 0.371355,
        "y": 0.272129,
        "z": -0.031985,
        "visibility": 1.0
      },
      {
        "index": 27,
        "x": 0.350514,
        "y": 0.254429,
        "z": -0.051659,
        "visibility": 1.0
      },
      {
        "index": 28,
        "x": 0.361378,
        "y": 0.257449,
        "z": -0.048646,
        "visibility": 1.0
      },
      {
        "index": 29,
        "x": 0.340293,
        "y": 0.252482,
        "z": -0.050822,
        "visibility": 1.0
      },
      {
        "index": 30,
        "x": 0.332865,
        "y": 0.252216,
        "z": -0.048116,
        "visibility": 1.0
      },
      {
        "index": 31,
        "x": 0.315367,
        "y": 0.260022,
        "z": -0.03148,
        "visibility": 1.0
      },
      {
        "index": 32,
        "x": 0.32778,
        "y": 0.353542,
        "z": 0.045548,
        "visibility": 1.0
      },
      {
        "index": 33,
        "x": 0.328549,
        "y": 0.258122,
        "z": -0.038072,
        "visibility": 1.0
      },
      {
        "index": 34,
        "x": 0.277479,
        "y": 0.233063,
        "z": -0.010021,
        "visibility": 1.0
      },
      {
        "index": 35,
        "x": 0.302227,
        "y": 0.249465,
        "z": -0.031029,
        "visibility": 1.0
      },
      {
        "index": 36,
        "x": 0.342805,
        "y": 0.300499,
        "z": -0.017505,
        "visibility": 1.0
      },
      {
        "index": 37,
        "x": 0.367009,
        "y": 0.338425,
        "z": -0.000809,
        "visibility": 1.0
      },
      {
        "index": 38,
        "x": 0.365619,
        "y": 0.342556,
        "z": 0.007226,
        "visibility": 1.0
      },
      {
        "index": 39,
        "x": 0.356041,
        "y": 0.335981,
        "z": 0.000863,
        "visibility": 1.0
      },
      {
        "index": 40,
        "x": 0.348713,
        "y": 0.334851,
        "z": 0.004761,
        "visibility": 1.0
      },
      {
        "index": 41,
        "x": 0.357281,
        "y": 0.339864,
        "z": 0.006749,
        "visibility": 1.0
      },
      {
        "index": 42,
        "x": 0.351204,
        "y": 0.338075,
        "z": 0.010093,
        "visibility": 1.0
      },
      {
        "index": 43,
        "x": 0.329943,
        "y": 0.335306,
        "z": 0.023891,
        "visibility": 1.0
      },
      {
        "index": 44,
        "x": 0.386755,
        "y": 0.331133,
        "z": -0.03787,
        "visibility": 1.0
      },
      {
        "index": 45,
        "x": 0.389595,
        "y": 0.32598,
        "z": -0.044502,
        "visibility": 1.0
      },
      {
        "index": 46,
        "x": 0.32008,
        "y": 0.242809,
        "z": -0.05808,
        "visibility": 1.0
      },
      {
        "index": 47,
        "x": 0.3696,
        "y": 0.288221,
        "z": -0.028062,
        "visibility": 1.0
      },
      {
        "index": 48,
        "x": 0.361979,
        "y": 0.31485,
        "z": -0.026087,
        "visibility": 1.0
      },
      {
        "index": 49,
        "x": 0.362499,
        "y": 0.309775,
        "z": -0.026272,
        "visibility": 1.0
      },
      {
        "index": 50,
        "x": 0.312054,
        "y": 0.288986,
        "z": -0.019185,
        "visibility": 1.0
      },
      {
        "index": 51,
        "x": 0.392795,
        "y": 0.316482,
        "z": -0.046431,
        "visibility": 1.0
      },
      {
        "index": 52,
        "x": 0.350194,
        "y": 0.248561,
        "z": -0.069015,
        "visibility": 1.0
      },
      {
        "index": 53,
        "x": 0.333869,
        "y": 0.244308,
        "z": -0.065989,
        "visibility": 1.0
      },
      {
        "index": 54,
        "x": 0.315105,
        "y": 0.200748,
        "z": -0.059831,
        "visibility": 1.0
      },
      {
        "index": 55,
        "x": 0.39313,
        "y": 0.266241,
        "z": -0.058948,
        "visibility": 1.0
      },
      {
        "index": 56,
        "x": 0.370801,
        "y": 0.261242,
        "z": -0.042241,
        "visibility": 1.0
      },
      {
        "index": 57,
        "x": 0.325652,
        "y": 0.329299,
        "z": 0.018049,
        "visibility": 1.0
      },
      {
        "index": 58,
        "x": 0.260179,
        "y": 0.289288,
        "z": 0.070358,
        "visibility": 1.0
      },
      {
        "index": 59,
        "x": 0.366393,
        "y": 0.319941,
        "z": -0.01877,
        "visibility": 1.0
      },
      {
        "index": 60,
        "x": 0.372629,
        "y": 0.324211,
        "z": -0.013513,
        "visibility": 1.0
      },
      {
        "index": 61,
        "x": 0.339604,
        "y": 0.334875,
        "z": 0.018324,
        "visibility": 1.0
      },
      {
        "index": 62,
        "x": 0.342146,
        "y": 0.335637,
        "z": 0.017691,
        "visibility": 1.0
      },
      {
        "index": 63,
        "x": 0.330055,
        "y": 0.236859,
        "z": -0.067445,
        "visibility": 1.0
      },
      {
        "index": 64,
        "x": 0.35978,
        "y": 0.314686,
        "z": -0.019303,
        "visibility": 1.0
      },
      {
        "index": 65,
        "x": 0.3694,
        "y": 0.255661,
        "z": -0.066738,
        "visibility": 1.0
      },
      {
        "index": 66,
        "x": 0.371252,
        "y": 0.249501,
        "z": -0.07308,
        "visibility": 1.0
      },
      {
        "index": 67,
        "x": 0.371751,
        "y": 0.205861,
        "z": -0.088118,
        "visibility": 1.0
      },
      {
        "index": 68,
        "x": 0.323692,
        "y": 0.218425,
        "z": -0.065043,
        "visibility": 1.0
      },
      {
        "index": 69,
        "x": 0.373548,
        "y": 0.227379,
        "z": -0.082001,
        "visibility": 1.0
      },
      {
        "index": 70,
        "x": 0.313721,
        "y": 0.235211,
        "z": -0.055646,
        "visibility": 1.0
      },
      {
        "index": 71,
        "x": 0.304889,
        "y": 0.220132,
        "z": -0.048615,
        "visibility": 1.0
      },
      {
        "index": 72,